{
  "schema": "hdsrc-materialization/v1",
  "materializationId": "mat:demo-4096-hmbt1-32",
  "stateId": "state:demo-4096",
  "stateRevision": 12,
  "stateDigest": "sha256:aaaaaaaaaaaaaaaaaaaaaaaaaaaaaaaaaaaaaaaaaaaaaaaaaaaaaaaaaaaaaaaa",
  "materializationDigest": "sha256:bbbbbbbbbbbbbbbbbbbbbbbbbbbbbbbbbbbbbbbbbbbbbbbbbbbbbbbbbbbbbbbb",
  "carrierProfile": "HMBT1",
  "spatializationId": "RCM_PP",
  "logicalScale": 32,
  "workloadDigest": "sha256:cccccccccccccccccccccccccccccccccccccccccccccccccccccccccccccccc",
  "machineResourceUri": "hdsrc://state/state:demo-4096/materializations/mat:demo-4096-hmbt1-32/machine",
  "previewResourceUri": "hdsrc://state/state:demo-4096/materializations/mat:demo-4096-hmbt1-32/preview"
}
